{
    "title": "âœ¨ Example prompt with two consecutive prompts",
    "pipelineUrl": "https://promptbook.studio/examples/two.book.md",
    "description": "Show how to use two consecutive prompts with one parameter each.",
    "formfactorName": "GENERIC",
    "parameters": [
        {
            "name": "word",
            "description": "Any single word",
            "isInput": true,
            "isOutput": false
        },
        {
            "name": "sentenceWithTwoSynonyms",
            "isInput": false,
            "isOutput": true,
            "exampleValues": [
                "The quick brown fox jumps over the lazy dog",
                "The brown {word} jumps over the lazy {word}"
            ]
        },
        {
            "name": "wordSynonym",
            "isInput": false,
            "isOutput": false
        }
    ],
    "tasks": [
        {
            "taskType": "PROMPT_TASK",
            "name": "synonym",
            "title": "ðŸ’¬ Synonym",
            "description": "Synonym for word",
            "content": "Write synonym for \"{word}\"",
            "resultingParameterName": "wordSynonym",
            "personaName": "Joe",
            "dependentParameterNames": [
                "word"
            ]
        },
        {
            "taskType": "PROMPT_TASK",
            "name": "sentence",
            "title": "ðŸ’¬ Sentence",
            "description": "Sentence with word and wordSynonym",
            "content": "Write sentence with \"{word}\" and \"{wordSynonym}\" in it",
            "resultingParameterName": "sentenceWithTwoSynonyms",
            "personaName": "Joe",
            "dependentParameterNames": [
                "word",
                "wordSynonym"
            ]
        }
    ],
    "personas": [
        {
            "name": "Joe",
            "description": "a linguist",
            "modelRequirements": {
                "modelVariant": "CHAT",
                "modelName": "gpt-4-turbo",
                "systemMessage": "You are a highly knowledgeable linguist with expertise in multiple languages, language families, linguistic theories, and the history of language. Your role is to assist users with questions about languages, grammar, etymology, phonetics, semantics, and any other linguistic topics. Provide clear, accurate, and insightful information, drawing from your vast knowledge of linguistics. Be prepared to explain complex linguistic concepts in an accessible way and to engage in discussions about language at various levels of technicality.",
                "temperature": 0.7
            },
            "preparationIds": [
                1
            ]
        }
    ],
    "preparations": [
        {
            "id": 1,
            "promptbookVersion": "0.82.0",
            "usage": {
                "price": {
                    "value": 0.005940000000000001
                },
                "input": {
                    "tokensCount": {
                        "value": 1165
                    },
                    "charactersCount": {
                        "value": 3214
                    },
                    "wordsCount": {
                        "value": 575
                    },
                    "sentencesCount": {
                        "value": 53
                    },
                    "linesCount": {
                        "value": 71
                    },
                    "paragraphsCount": {
                        "value": 20
                    },
                    "pagesCount": {
                        "value": 2
                    }
                },
                "output": {
                    "tokensCount": {
                        "value": 163
                    },
                    "charactersCount": {
                        "value": 711
                    },
                    "wordsCount": {
                        "value": 100
                    },
                    "sentencesCount": {
                        "value": 6
                    },
                    "linesCount": {
                        "value": 17
                    },
                    "paragraphsCount": {
                        "value": 2
                    },
                    "pagesCount": {
                        "value": 1
                    }
                }
            }
        }
    ],
    "knowledgeSources": [],
    "knowledgePieces": [],
    "sources": [
        {
            "type": "BOOK",
            "path": null,
            "content": "# âœ¨ Example prompt with two consecutive prompts\n\nShow how to use two consecutive prompts with one parameter each.\n\n-   PIPELINE URL https://promptbook.studio/examples/two.book.md\n-   INPUTâ€¯â€¯PARAMETER `{word}` Any single word\n-   OUTPUT PARAMETER `{sentenceWithTwoSynonyms}`\n\n<!--Graph-->\n<!-- âš ï¸ WARNING: This code has been generated so that any manual changes will be overwritten -->\n\n```mermaid\n%% ðŸ”® Tip: Open this on GitHub or in the VSCode website to see the Mermaid graph visually\n\nflowchart LR\n  subgraph \"âœ¨ Example prompt with two consecutive prompts\"\n\n      direction TB\n\n      input((Input)):::input\n      synonym(\"ðŸ’¬ Synonym\")\n      input--\"{word}\"-->synonym\n      sentence(\"ðŸ’¬ Sentence\")\n      input--\"{word}\"-->sentence\n      synonym--\"{wordSynonym}\"-->sentence\n\n      sentence--\"{sentenceWithTwoSynonyms}\"-->output\n      output((Output)):::output\n\n      click synonym href \"#synonym\" \"ðŸ’¬ Synonym\";\n      click sentence href \"#sentence\" \"ðŸ’¬ Sentence\";\n\n      classDef input color: grey;\n      classDef output color: grey;\n\n  end;\n```\n\n<!--/Graph-->\n\n## ðŸ’¬ Synonym\n\nSynonym for word\n\n-   PERSONA Joe, a linguist\n\n```text\nWrite synonym for \"{word}\"\n```\n\n`-> {wordSynonym}`\n\n## ðŸ’¬ Sentence\n\nSentence with word and wordSynonym\n\n-   PERSONA Joe\n\n```text\nWrite sentence with \"{word}\" and \"{wordSynonym}\" in it\n```\n\n`-> {sentenceWithTwoSynonyms}`\n\n### Simple sentence\n\n-   EXAMPLE\n\n```text\nThe quick brown fox jumps over the lazy dog\n```\n\n`-> {sentenceWithTwoSynonyms}`\n\n### Dynamic sentence\n\n-   EXAMPLE\n\n```text\nThe brown {word} jumps over the lazy {word}\n```\n\n`-> {sentenceWithTwoSynonyms}`\n"
        }
    ]
}
