{
    "title": "âœ¨ Example: Postprocessing 1",
    "pipelineUrl": "https://promptbook.studio/examples/postprocessing-1.book.md",
    "description": "Show how to use two consecutive prompts with one parameter each.",
    "formfactorName": "GENERIC",
    "parameters": [
        {
            "name": "word",
            "description": "Any single word",
            "isInput": true,
            "isOutput": false,
            "exampleValues": [
                "Happy",
                "Apple"
            ]
        },
        {
            "name": "sentence",
            "description": "Resulting sentence with two synonyms",
            "isInput": false,
            "isOutput": true,
            "exampleValues": [
                "I am very happy to see you and joyful to meet you.",
                "An apple or another fruit a day keeps the doctor away."
            ]
        },
        {
            "name": "wordSynonym",
            "isInput": false,
            "isOutput": false,
            "exampleValues": [
                "Joyful",
                "Fruit"
            ]
        }
    ],
    "tasks": [
        {
            "taskType": "PROMPT_TASK",
            "name": "synonym",
            "title": "ðŸ’¬ Synonym",
            "description": "Synonym for word",
            "content": "Write synonym for \"{word}\"",
            "resultingParameterName": "wordSynonym",
            "postprocessingFunctionNames": [
                "unwrapResult"
            ],
            "dependentParameterNames": [
                "word"
            ]
        },
        {
            "taskType": "PROMPT_TASK",
            "name": "sentence",
            "title": "ðŸ’¬ Sentence",
            "description": "Sentence with word and wordSynonym",
            "content": "Write sentence with \"{word}\" and \"{wordSynonym}\" in it",
            "resultingParameterName": "sentence",
            "postprocessingFunctionNames": [
                "unwrapResult",
                "spaceTrim"
            ],
            "dependentParameterNames": [
                "word",
                "wordSynonym"
            ]
        }
    ],
    "personas": [],
    "preparations": [],
    "knowledgeSources": [],
    "knowledgePieces": [],
    "sources": [
        {
            "type": "BOOK",
            "path": null,
            "content": "# âœ¨ Example: Postprocessing 1\n\nShow how to use two consecutive prompts with one parameter each.\n\n-   PIPELINE URL https://promptbook.studio/examples/postprocessing-1.book.md\n-   INPUTâ€¯â€¯PARAMETER `{word}` Any single word\n-   OUTPUT PARAMETER `{sentence}` Resulting sentence with two synonyms\n\n<!--Graph-->\n<!-- âš ï¸ WARNING: This code has been generated so that any manual changes will be overwritten -->\n\n```mermaid\n%% ðŸ”® Tip: Open this on GitHub or in the VSCode website to see the Mermaid graph visually\n\nflowchart LR\n  subgraph \"âœ¨ Example: Postprocessing 1\"\n\n      direction TB\n\n      input((Input)):::input\n      synonym(\"ðŸ’¬ Synonym\")\n      input--\"{word}\"-->synonym\n      sentence(\"ðŸ’¬ Sentence\")\n      input--\"{word}\"-->sentence\n      synonym--\"{wordSynonym}\"-->sentence\n\n      sentence--\"{sentence}\"-->output\n      output((Output)):::output\n\n      click synonym href \"#synonym\" \"ðŸ’¬ Synonym\";\n      click sentence href \"#sentence\" \"ðŸ’¬ Sentence\";\n\n      classDef input color: grey;\n      classDef output color: grey;\n\n  end;\n```\n\n<!--/Graph-->\n\n### Example 1\n\n-   EXAMPLE\n\n```text\nHappy\n```\n\n`-> {word}`\n\n### Example 2\n\n-   EXAMPLE\n\n```text\nApple\n```\n\n`-> {word}`\n\n## ðŸ’¬ Synonym\n\nSynonym for word\n\n-   POSTPROCESSING `unwrapResult`\n\n```text\nWrite synonym for \"{word}\"\n```\n\n`-> {wordSynonym}`\n\n### Example 1\n\n-   EXAMPLE\n\n```text\nJoyful\n```\n\n`-> {wordSynonym}`\n\n### Example 2\n\n-   EXAMPLE\n\n```text\nFruit\n```\n\n`-> {wordSynonym}`\n\n## ðŸ’¬ Sentence\n\nSentence with word and wordSynonym\n\n-   POSTPROCESSING `unwrapResult`\n-   POSTPROCESSING `spaceTrim`\n\n```text\nWrite sentence with \"{word}\" and \"{wordSynonym}\" in it\n```\n\n`-> {sentence}`\n\n### Example 1\n\n-   EXAMPLE\n\n```text\nI am very happy to see you and joyful to meet you.\n```\n\n`-> {sentence}`\n\n### Example 2\n\n-   EXAMPLE\n\n```text\nAn apple or another fruit a day keeps the doctor away.\n```\n\n`-> {sentence}`\n"
        }
    ]
}
