{
    "title": "âœ¨ Example: Language Capabilities",
    "pipelineUrl": "https://promptbook.studio/examples/advanced.book.md",
    "description": "Trying the language capabilities of GPT models.",
    "formfactorName": "GENERIC",
    "parameters": [
        {
            "name": "word",
            "description": "The word to use in the prompt.",
            "isInput": true,
            "isOutput": false
        },
        {
            "name": "comparisonOfTwoSentences",
            "description": "Comparison between two sentences",
            "isInput": false,
            "isOutput": true
        },
        {
            "name": "summary",
            "description": "The overall summary of the comparison",
            "isInput": false,
            "isOutput": true,
            "exampleValues": [
                "You have entered a word **happy**. For this word the best synonym is **joyful**. The sentence with both words is **I was happy and you were joyful!**. The sentence without the original word is **I was and you were joyful!**. And the comparison between the two sentences is:\n\n> The sentence with both words is more expressive than the sentence without the original word."
            ]
        },
        {
            "name": "wordSynonymTested",
            "isInput": false,
            "isOutput": true
        },
        {
            "name": "wordSynonym",
            "isInput": false,
            "isOutput": false
        },
        {
            "name": "sentenceWithTwoSynonyms",
            "description": "Sentence with word and wordSynonym",
            "isInput": false,
            "isOutput": false,
            "exampleValues": [
                "I was happy and you were joyful!"
            ]
        },
        {
            "name": "sentenceWithOriginalWordRemoved",
            "description": "Sentence with both synomyms but without a original word",
            "isInput": false,
            "isOutput": false
        }
    ],
    "tasks": [
        {
            "taskType": "PROMPT_TASK",
            "name": "synonym",
            "title": "ðŸ’¬ Synonym",
            "description": "Synonym for word",
            "content": "Write synonym for \"{word}\"",
            "resultingParameterName": "wordSynonym",
            "personaName": "Joe",
            "modelRequirements": {
                "modelName": "gpt-3.5-turbo"
            },
            "postprocessingFunctionNames": [
                "unwrapResult"
            ],
            "expectations": {
                "words": {
                    "min": 1,
                    "max": 1
                }
            },
            "dependentParameterNames": [
                "word"
            ]
        },
        {
            "taskType": "SCRIPT_TASK",
            "name": "test-that-word-is-not-original-word",
            "title": "âš™ Test that word is not original word",
            "content": "if (word !== '' && wordSynonym === word) {\n    throw new Error(`Synonym returned from LLM is same as original word \"${word}\"`);\n}\n\nreturn wordSynonym;",
            "resultingParameterName": "wordSynonymTested",
            "contentLanguage": "javascript",
            "dependentParameterNames": [
                "word",
                "wordSynonym"
            ]
        },
        {
            "taskType": "PROMPT_TASK",
            "name": "sentence-with-synonym",
            "title": "ðŸ’¬ Sentence with Synonym",
            "description": "Sentence with word and wordSynonym",
            "content": "Write sentence with \"{word}\" and \"{wordSynonym}\" in it",
            "resultingParameterName": "sentenceWithTwoSynonyms",
            "personaName": "Jane",
            "modelRequirements": {
                "modelName": "gpt-3.5-turbo"
            },
            "expectations": {
                "words": {
                    "max": 20
                },
                "sentences": {
                    "min": 1,
                    "max": 1
                }
            },
            "dependentParameterNames": [
                "word",
                "wordSynonym"
            ]
        },
        {
            "taskType": "PROMPT_TASK",
            "name": "sentence-without-original-word",
            "title": "ðŸ’¬ Sentence without original word",
            "description": "Sentence \"{sentenceWithTwoSynonyms}\" without \"{word}\".",
            "content": "Remove word \"{word}\" from sentence and modify it so that it makes sense:\n\n## Rules:\n\n-   Sentence must be grammatically correct\n-   Sentence must make sense after removing the word\n\n## The Sentence:\n\n> {sentenceWithTwoSynonyms}",
            "resultingParameterName": "sentenceWithOriginalWordRemoved",
            "personaName": "Josh",
            "expectations": {
                "words": {
                    "max": 20
                },
                "sentences": {
                    "min": 1,
                    "max": 1
                }
            },
            "dependentParameterNames": [
                "sentenceWithTwoSynonyms",
                "word"
            ]
        },
        {
            "taskType": "PROMPT_TASK",
            "name": "comparison",
            "title": "ðŸ’¬ Comparison",
            "description": "Comparison between \"{sentenceWithTwoSynonyms}\" and \"{sentenceWithOriginalWordRemoved}\".",
            "content": "Write a short comparison of the meaning of the two sentences, writing a maximum of 5 sentences:\n\n## Sentence 1:\n\n> {sentenceWithTwoSynonyms}\n\n## Sentence 2:\n\n> {sentenceWithOriginalWordRemoved}",
            "resultingParameterName": "comparisonOfTwoSentences",
            "personaName": "Alice",
            "modelRequirements": {
                "modelVariant": "CHAT",
                "modelName": "gpt-4o"
            },
            "expectations": {
                "sentences": {
                    "min": 1,
                    "max": 5
                }
            },
            "dependentParameterNames": [
                "sentenceWithTwoSynonyms",
                "sentenceWithOriginalWordRemoved"
            ]
        },
        {
            "taskType": "SIMPLE_TASK",
            "name": "summary",
            "title": "ðŸ”— Summary",
            "content": "You have entered a word **{word}**. For this word the best synonym is **{wordSynonym}**. The sentence with both words is **{sentenceWithTwoSynonyms}**. The sentence without the original word is **{sentenceWithOriginalWordRemoved}**. And the comparison between the two sentences is:\n\n> {comparisonOfTwoSentences}",
            "resultingParameterName": "summary",
            "dependentParameterNames": [
                "word",
                "wordSynonym",
                "sentenceWithTwoSynonyms",
                "sentenceWithOriginalWordRemoved",
                "comparisonOfTwoSentences"
            ]
        }
    ],
    "personas": [
        {
            "name": "Joe",
            "description": "a linguist",
            "modelRequirements": {
                "modelVariant": "CHAT",
                "modelName": "gpt-4-turbo",
                "systemMessage": "You are a highly knowledgeable linguist with expertise in multiple languages, language families, linguistic theories, and the history of language. Your role is to assist users with questions about languages, grammar, etymology, phonetics, semantics, and any other linguistic topics. Provide clear, accurate, and insightful information, drawing from your vast knowledge of linguistics. Be prepared to explain complex linguistic concepts in an accessible way and to engage in discussions about language at various levels of technicality.",
                "temperature": 0.7
            },
            "preparationIds": [
                1
            ]
        },
        {
            "name": "Jane",
            "description": "a linguist",
            "modelRequirements": {
                "modelVariant": "CHAT",
                "modelName": "gpt-4-turbo",
                "systemMessage": "You are a highly knowledgeable linguist with expertise in multiple languages, language families, linguistic theories, and the history of language. Your role is to assist users with questions about languages, grammar, etymology, phonetics, semantics, and any other linguistic topics. Provide clear, accurate, and insightful information, drawing from your vast knowledge of linguistics. Be prepared to explain complex linguistic concepts in an accessible way and to engage in discussions about language at various levels of technicality.",
                "temperature": 0.7
            },
            "preparationIds": [
                1
            ]
        },
        {
            "name": "Josh",
            "description": "a linguist",
            "modelRequirements": {
                "modelVariant": "CHAT",
                "modelName": "gpt-4-turbo",
                "systemMessage": "You are a highly knowledgeable linguist with expertise in multiple languages, language families, linguistic theories, and the history of language. Your role is to assist users with questions about languages, grammar, etymology, phonetics, semantics, and any other linguistic topics. Provide clear, accurate, and insightful information, drawing from your vast knowledge of linguistics. Be prepared to explain complex linguistic concepts in an accessible way and to engage in discussions about language at various levels of technicality.",
                "temperature": 0.7
            },
            "preparationIds": [
                1
            ]
        },
        {
            "name": "Alice",
            "description": "a linguist",
            "modelRequirements": {
                "modelVariant": "CHAT",
                "modelName": "gpt-4-turbo",
                "systemMessage": "You are a highly knowledgeable linguist with expertise in multiple languages, language families, linguistic theories, and the history of language. Your role is to assist users with questions about languages, grammar, etymology, phonetics, semantics, and any other linguistic topics. Provide clear, accurate, and insightful information, drawing from your vast knowledge of linguistics. Be prepared to explain complex linguistic concepts in an accessible way and to engage in discussions about language at various levels of technicality.",
                "temperature": 0.7
            },
            "preparationIds": [
                1
            ]
        }
    ],
    "preparations": [
        {
            "id": 1,
            "promptbookVersion": "0.82.0",
            "usage": {
                "price": {
                    "value": 0.023760000000000003
                },
                "input": {
                    "tokensCount": {
                        "value": 4660
                    },
                    "charactersCount": {
                        "value": 12856
                    },
                    "wordsCount": {
                        "value": 2300
                    },
                    "sentencesCount": {
                        "value": 212
                    },
                    "linesCount": {
                        "value": 284
                    },
                    "paragraphsCount": {
                        "value": 80
                    },
                    "pagesCount": {
                        "value": 8
                    }
                },
                "output": {
                    "tokensCount": {
                        "value": 652
                    },
                    "charactersCount": {
                        "value": 2844
                    },
                    "wordsCount": {
                        "value": 400
                    },
                    "sentencesCount": {
                        "value": 24
                    },
                    "linesCount": {
                        "value": 68
                    },
                    "paragraphsCount": {
                        "value": 8
                    },
                    "pagesCount": {
                        "value": 4
                    }
                }
            }
        }
    ],
    "knowledgeSources": [],
    "knowledgePieces": [],
    "sources": [
        {
            "type": "BOOK",
            "path": null,
            "content": "# âœ¨ Example: Language Capabilities\n\nTrying the language capabilities of GPT models.\n\n-   PIPELINE URL https://promptbook.studio/examples/advanced.book.md\n-   INPUTâ€¯â€¯PARAMETER `{word}` The word to use in the prompt.\n-   OUTPUTâ€¯PARAMETER `{comparisonOfTwoSentences}` Comparison between two sentences\n-   OUTPUTâ€¯PARAMETER `{summary}` The overall summary of the comparison\n-   OUTPUT PARAMETER `{wordSynonymTested}`\n\n<!--Graph-->\n<!-- âš ï¸ WARNING: This code has been generated so that any manual changes will be overwritten -->\n\n```mermaid\n%% ðŸ”® Tip: Open this on GitHub or in the VSCode website to see the Mermaid graph visually\n\nflowchart LR\n  subgraph \"âœ¨ Example: Language Capabilities\"\n\n      direction TB\n\n      input((Input)):::input\n      synonym(\"ðŸ’¬ Synonym\")\n      input--\"{word}\"-->synonym\n      test-that-word-is-not-original-word(\"âš™ Test that word is not original word\")\n      input--\"{word}\"-->test-that-word-is-not-original-word\n      synonym--\"{wordSynonym}\"-->test-that-word-is-not-original-word\n      sentence-with-synonym(\"ðŸ’¬ Sentence with Synonym\")\n      input--\"{word}\"-->sentence-with-synonym\n      synonym--\"{wordSynonym}\"-->sentence-with-synonym\n      sentence-without-original-word(\"ðŸ’¬ Sentence without original word\")\n      sentence-with-synonym--\"{sentenceWithTwoSynonyms}\"-->sentence-without-original-word\n      input--\"{word}\"-->sentence-without-original-word\n      comparison(\"ðŸ’¬ Comparison\")\n      sentence-with-synonym--\"{sentenceWithTwoSynonyms}\"-->comparison\n      sentence-without-original-word--\"{sentenceWithOriginalWordRemoved}\"-->comparison\n      summary(\"ðŸ”— Summary\")\n      input--\"{word}\"-->summary\n      synonym--\"{wordSynonym}\"-->summary\n      sentence-with-synonym--\"{sentenceWithTwoSynonyms}\"-->summary\n      sentence-without-original-word--\"{sentenceWithOriginalWordRemoved}\"-->summary\n      comparison--\"{comparisonOfTwoSentences}\"-->summary\n\n      comparison--\"{comparisonOfTwoSentences}\"-->output\n      summary--\"{summary}\"-->output\n      test-that-word-is-not-original-word--\"{wordSynonymTested}\"-->output\n      output((Output)):::output\n\n      click synonym href \"#synonym\" \"ðŸ’¬ Synonym\";\n      click test-that-word-is-not-original-word href \"#test-that-word-is-not-original-word\" \"âš™ Test that word is not original word\";\n      click sentence-with-synonym href \"#sentence-with-synonym\" \"ðŸ’¬ Sentence with Synonym\";\n      click sentence-without-original-word href \"#sentence-without-original-word\" \"ðŸ’¬ Sentence without original word\";\n      click comparison href \"#comparison\" \"ðŸ’¬ Comparison\";\n      click summary href \"#summary\" \"ðŸ”— Summary\";\n\n      classDef input color: grey;\n      classDef output color: grey;\n\n  end;\n```\n\n<!--/Graph-->\n\n## ðŸ’¬ Synonym\n\nSynonym for word\n\n-   PERSONA Joe, a linguist\n-   MODEL NAME `gpt-3.5-turbo`\n-   POSTPROCESSING `unwrapResult`\n-   EXPECT EXACTLY 1 WORD\n\n```text\nWrite synonym for \"{word}\"\n```\n\n`-> {wordSynonym}`\n\n## âš™ Test that word is not original word\n\n-   SCRIPT\n\n```javascript\nif (word !== '' && wordSynonym === word) {\n    throw new Error(`Synonym returned from LLM is same as original word \"${word}\"`);\n}\n\nreturn wordSynonym;\n```\n\n`-> {wordSynonymTested}`\n\n## ðŸ’¬ Sentence with Synonym\n\nSentence with word and wordSynonym\n\n-   PERSONA Jane, a linguist\n-   MODEL NAME `gpt-3.5-turbo`\n-   EXPECT MAX 20 WORDS\n-   EXPECT EXACTLY 1 SENTENCE\n\n```text\nWrite sentence with \"{word}\" and \"{wordSynonym}\" in it\n```\n\n`-> {sentenceWithTwoSynonyms}` Sentence with word and wordSynonym\n\n### Example of sentence with word and wordSynonym\n\n-   EXAMPLE\n\n```text\nI was happy and you were joyful!\n```\n\n`-> {sentenceWithTwoSynonyms}`\n\n## ðŸ’¬ Sentence without original word\n\nSentence \"{sentenceWithTwoSynonyms}\" without \"{word}\".\n\n-   PERSONA Josh, a linguist\n-   EXPECT MAX 20 WORDS\n-   EXPECT EXACTLY 1 SENTENCE\n\n```markdown\nRemove word \"{word}\" from sentence and modify it so that it makes sense:\n\n## Rules:\n\n-   Sentence must be grammatically correct\n-   Sentence must make sense after removing the word\n\n## The Sentence:\n\n> {sentenceWithTwoSynonyms}\n```\n\n`-> {sentenceWithOriginalWordRemoved}` Sentence with both synomyms but without a original word\n\n## ðŸ’¬ Comparison\n\nComparison between \"{sentenceWithTwoSynonyms}\" and \"{sentenceWithOriginalWordRemoved}\".\n\n-   PERSONA Alice, a linguist\n-   MODEL VARIANT Chat\n-   MODEL NAME `gpt-4o`\n-   EXPECT MIN 1 SENTENCE\n-   EXPECT MAX 5 SENTENCES\n\n```markdown\nWrite a short comparison of the meaning of the two sentences, writing a maximum of 5 sentences:\n\n## Sentence 1:\n\n> {sentenceWithTwoSynonyms}\n\n## Sentence 2:\n\n> {sentenceWithOriginalWordRemoved}\n```\n\n`-> {comparisonOfTwoSentences}` Comparison between two sentences\n\n## ðŸ”— Summary\n\n-   SIMPLE TEMPLATE\n\n```markdown\nYou have entered a word **{word}**. For this word the best synonym is **{wordSynonym}**. The sentence with both words is **{sentenceWithTwoSynonyms}**. The sentence without the original word is **{sentenceWithOriginalWordRemoved}**. And the comparison between the two sentences is:\n\n> {comparisonOfTwoSentences}\n```\n\n`-> {summary}`\n\n### Example of summary\n\n-   EXAMPLE\n\n```markdown\nYou have entered a word **happy**. For this word the best synonym is **joyful**. The sentence with both words is **I was happy and you were joyful!**. The sentence without the original word is **I was and you were joyful!**. And the comparison between the two sentences is:\n\n> The sentence with both words is more expressive than the sentence without the original word.\n```\n\n`-> {summary}`\n"
        }
    ]
}
