{
    "title": "âœ¨ Write greeting for each customer",
    "pipelineUrl": "https://promptbook.studio/examples/foreach-list.book.md",
    "description": "Show how to iterate over a list of customers and write a greeting for each.",
    "formfactorName": "GENERIC",
    "parameters": [
        {
            "name": "customers",
            "description": "Customer names each customer on each row",
            "isInput": true,
            "isOutput": false,
            "exampleValues": [
                "Paul\nJohn"
            ]
        },
        {
            "name": "greetings",
            "description": "Greeting to each customer on each row",
            "isInput": false,
            "isOutput": true,
            "exampleValues": [
                "Hello Paul\nHi John"
            ]
        }
    ],
    "tasks": [
        {
            "taskType": "PROMPT_TASK",
            "name": "write-a-greeting",
            "title": "Write a greeting",
            "content": "Write an email greeting for \"{customer}\"\n\n## Rules\n\n-   Write just a greeting, nothing else",
            "resultingParameterName": "greetings",
            "foreach": {
                "formatName": "TEXT",
                "subformatName": "LINE",
                "parameterName": "customers",
                "inputSubparameterNames": [
                    "customer"
                ],
                "outputSubparameterName": "newLine"
            },
            "personaName": "Jane",
            "dependentParameterNames": [
                "customers"
            ]
        }
    ],
    "personas": [
        {
            "name": "Jane",
            "description": "customer service representative",
            "modelRequirements": {
                "modelVariant": "CHAT",
                "modelName": "gpt-4-turbo",
                "systemMessage": "You are a friendly and professional customer service representative. Your goal is to assist customers with their inquiries, resolve issues, and ensure a positive experience. Provide clear, concise, and helpful information while maintaining a polite and empathetic tone.",
                "temperature": 0.7
            },
            "preparationIds": [
                1
            ]
        }
    ],
    "preparations": [
        {
            "id": 1,
            "promptbookVersion": "0.82.0",
            "usage": {
                "price": {
                    "value": 0.0051600000000000005
                },
                "input": {
                    "tokensCount": {
                        "value": 1165
                    },
                    "charactersCount": {
                        "value": 3235
                    },
                    "wordsCount": {
                        "value": 576
                    },
                    "sentencesCount": {
                        "value": 53
                    },
                    "linesCount": {
                        "value": 71
                    },
                    "paragraphsCount": {
                        "value": 20
                    },
                    "pagesCount": {
                        "value": 2
                    }
                },
                "output": {
                    "tokensCount": {
                        "value": 111
                    },
                    "charactersCount": {
                        "value": 458
                    },
                    "wordsCount": {
                        "value": 63
                    },
                    "sentencesCount": {
                        "value": 5
                    },
                    "linesCount": {
                        "value": 13
                    },
                    "paragraphsCount": {
                        "value": 2
                    },
                    "pagesCount": {
                        "value": 1
                    }
                }
            }
        }
    ],
    "knowledgeSources": [],
    "knowledgePieces": [],
    "sources": [
        {
            "type": "BOOK",
            "path": null,
            "content": "# âœ¨ Write greeting for each customer\n\nShow how to iterate over a list of customers and write a greeting for each.\n\n-   PIPELINE URL https://promptbook.studio/examples/foreach-list.book.md\n-   INPUT PARAMETER `{customers}` Customer names each customer on each row\n-   OUTPUT PARAMETER `{greetings}` Greeting to each customer on each row\n\n<!--Graph-->\n<!-- âš ï¸ WARNING: This code has been generated so that any manual changes will be overwritten -->\n\n```mermaid\n%% ðŸ”® Tip: Open this on GitHub or in the VSCode website to see the Mermaid graph visually\n\nflowchart LR\n  subgraph \"âœ¨ Write greeting for each customer\"\n\n      direction TB\n\n      input((Input)):::input\n      write-a-greeting(\"Write a greeting\")\n      input--\"{customers}\"-->write-a-greeting\n\n      write-a-greeting--\"{greetings}\"-->output\n      output((Output)):::output\n\n      click write-a-greeting href \"#write-a-greeting\" \"Write a greeting\";\n\n      classDef input color: grey;\n      classDef output color: grey;\n\n  end;\n```\n\n<!--/Graph-->\n\n## Write a greeting\n\n-   FOREACH Text Line `{customers}` -> `{customer}`\n-   PERSONA Jane, customer service representative\n<!--- TODO: Add EXPECT -->\n\n```markdown\nWrite an email greeting for \"{customer}\"\n\n## Rules\n\n-   Write just a greeting, nothing else\n```\n\n`-> {greetings}`\n\n### Examples of customers\n\n-   EXAMPLE\n\n```text\nPaul\nJohn\n```\n\n`-> {customers}`\n\n### Examples of greetings\n\n-   EXAMPLE\n\n```text\nHello Paul\nHi John\n```\n\n`-> {greetings}`\n"
        }
    ]
}
